{
    "snapshot":  {
                     "header":  {
                                    "enm_version":  "1.0",
                                    "name":  "Model sieci - manual-g",
                                    "description":  null,
                                    "created_at":  "2026-05-11T04:19:25.414839Z",
                                    "updated_at":  "2026-05-11T04:19:25.434705Z",
                                    "revision":  2,
                                    "hash_sha256":  "35ac656a8f20bb5d22e18f699ec4c40b8fad00ba9ad692f88b512bd5cad690af",
                                    "defaults":  {
                                                     "frequency_hz":  50.0,
                                                     "unit_system":  "SI",
                                                     "sn_nominal_kv":  null
                                                 },
                                    "semantic_hash":  null,
                                    "input_hash":  null,
                                    "case_hash":  null,
                                    "variant_hash":  null,
                                    "switching_snapshot_hash":  null
                                },
                     "buses":  [
                                   {
                                       "id":  "9b53eb2b-5ab0-4bf8-a343-7487ee754702",
                                       "ref_id":  "gpz/e1b125f59ca1c7b79b013328b77aa982/section/001/bus_sn",
                                       "name":  "Szyna GPZ S1 15 kV",
                                       "tags":  [

                                                ],
                                       "meta":  {
                                                    "gpz_section_id":  "gpz/e1b125f59ca1c7b79b013328b77aa982/section/001",
                                                    "gpz_section_order":  0,
                                                    "gpz_substation_ref":  "gpz/e1b125f59ca1c7b79b013328b77aa982/substation"
                                                },
                                       "voltage_kv":  15.0,
                                       "frequency_hz":  null,
                                       "phase_system":  "3ph",
                                       "zone":  "GPZ",
                                       "grounding":  {
                                                         "type":  "resistor_grounded",
                                                         "r_ohm":  12.0,
                                                         "x_ohm":  null
                                                     },
                                       "nominal_limits":  null
                                   },
                                   {
                                       "id":  "85b55fa9-4a3e-4998-8f6d-2ca48ca7ece0",
                                       "ref_id":  "gpz/e1b125f59ca1c7b79b013328b77aa982/section/002/bus_sn",
                                       "name":  "Szyna GPZ S2 15 kV",
                                       "tags":  [

                                                ],
                                       "meta":  {
                                                    "gpz_section_id":  "gpz/e1b125f59ca1c7b79b013328b77aa982/section/002",
                                                    "gpz_section_order":  1,
                                                    "gpz_substation_ref":  "gpz/e1b125f59ca1c7b79b013328b77aa982/substation"
                                                },
                                       "voltage_kv":  15.0,
                                       "frequency_hz":  null,
                                       "phase_system":  "3ph",
                                       "zone":  "GPZ",
                                       "grounding":  {
                                                         "type":  "resistor_grounded",
                                                         "r_ohm":  12.0,
                                                         "x_ohm":  null
                                                     },
                                       "nominal_limits":  null
                                   },
                                   {
                                       "id":  "13c4a3fb-08e3-4cb5-80e0-ea83a1eb1ddc",
                                       "ref_id":  "gpz/e1b125f59ca1c7b79b013328b77aa982/transformer/001/bus_110",
                                       "name":  "Szyna 110 kV TR1",
                                       "tags":  [
                                                    "gpz_hv_bus",
                                                    "helper_bus"
                                                ],
                                       "meta":  {
                                                    "visual_role":  "GPZ_HV_BUS",
                                                    "gpz_substation_ref":  "gpz/e1b125f59ca1c7b79b013328b77aa982/substation",
                                                    "gpz_transformer_ref":  "gpz/e1b125f59ca1c7b79b013328b77aa982/transformer/001/wn_sn",
                                                    "render_on_sld":  true,
                                                    "show_in_project_tree":  false
                                                },
                                       "voltage_kv":  110.0,
                                       "frequency_hz":  null,
                                       "phase_system":  "3ph",
                                       "zone":  null,
                                       "grounding":  null,
                                       "nominal_limits":  null
                                   },
                                   {
                                       "id":  "5376e4bb-6fdd-4198-8774-2a5f45c983dd",
                                       "ref_id":  "gpz/e1b125f59ca1c7b79b013328b77aa982/transformer/002/bus_110",
                                       "name":  "Szyna 110 kV TR2",
                                       "tags":  [
                                                    "gpz_hv_bus",
                                                    "helper_bus"
                                                ],
                                       "meta":  {
                                                    "visual_role":  "GPZ_HV_BUS",
                                                    "gpz_substation_ref":  "gpz/e1b125f59ca1c7b79b013328b77aa982/substation",
                                                    "gpz_transformer_ref":  "gpz/e1b125f59ca1c7b79b013328b77aa982/transformer/002/wn_sn",
                                                    "render_on_sld":  true,
                                                    "show_in_project_tree":  false
                                                },
                                       "voltage_kv":  110.0,
                                       "frequency_hz":  null,
                                       "phase_system":  "3ph",
                                       "zone":  null,
                                       "grounding":  null,
                                       "nominal_limits":  null
                                   }
                               ],
                     "branches":  [
                                      {
                                          "id":  "fa3735f0-ad84-4a94-8bec-88557f351811",
                                          "ref_id":  "gpz/e1b125f59ca1c7b79b013328b77aa982/coupler/001",
                                          "name":  "SprzÄgÅo sekcji GPZ 1-2",
                                          "tags":  [

                                                   ],
                                          "meta":  {

                                                   },
                                          "from_bus_ref":  "gpz/e1b125f59ca1c7b79b013328b77aa982/section/001/bus_sn",
                                          "to_bus_ref":  "gpz/e1b125f59ca1c7b79b013328b77aa982/section/002/bus_sn",
                                          "status":  "closed",
                                          "catalog_ref":  null,
                                          "catalog_namespace":  null,
                                          "parameter_source":  null,
                                          "source_mode":  null,
                                          "materialized_params":  null,
                                          "overrides":  [

                                                        ],
                                          "type":  "bus_coupler",
                                          "r_ohm":  null,
                                          "x_ohm":  null
                                      }
                                  ],
                     "transformers":  [
                                          {
                                              "id":  "f2064dff-3ade-47b5-a79b-16f3aaa206a4",
                                              "ref_id":  "gpz/e1b125f59ca1c7b79b013328b77aa982/transformer/001/wn_sn",
                                              "name":  "TR1 110/15 kV",
                                              "tags":  [
                                                           "gpz_wn_sn_transformer"
                                                       ],
                                              "meta":  {
                                                           "gpz_substation_ref":  "gpz/e1b125f59ca1c7b79b013328b77aa982/substation",
                                                           "gpz_section_id":  "gpz/e1b125f59ca1c7b79b013328b77aa982/section/001",
                                                           "gpz_section_order":  0,